Item ID,Item,POS,Translation,Lesson Title,Reading or Listening,Course Code,CEFR Level,Domain,Context,Target Word
2779,length,noun,la longueur ,How Oscillators Work,reading,LANGL1171A,B2,Civil Engineering,"As a civil engineer, one must consider various factors such as the length of pipes, cables and other structures when designing buildings or infrastructure projects.",length
2779,length,noun,la longueur ,How Oscillators Work,reading,LANGL1171A,B2,Civil Engineering,The length of a beam is crucial in determining the stability of the structure it supports.,length
2779,length,noun,la longueur ,How Oscillators Work,reading,LANGL1171A,B2,Civil Engineering,"The bridge, which was constructed in 1905, has been expanded over several periods to increase its length and withstand the increased traffic volume.",length
2779,length,noun,la longueur ,How Oscillators Work,reading,LANGL1171A,B2,Civil Engineering,The length of the bridge can be calculated by measuring the distance between the two supporting points.,length
2779,length,noun,la longueur ,How Oscillators Work,reading,LANGL1171A,B2,Civil Engineering,"Longitudinal stresses have an effect on the length of structural elements. In civil engineering, it's crucial to consider these stresses when designing and constructing structures that will be subjected to high loads over long periods.",length
2779,length,noun,la longueur ,How Oscillators Work,reading,LANGL1171A,B2,Civil Engineering,"In order to determine the length of a bridge, engineers usually perform an analysis of the materials used and their ability to support a load.",length
2779,length,noun,la longueur ,How Oscillators Work,reading,LANGL1171A,B2,Civil Engineering,"In order to calculate the required length of reinforced concrete beams for supporting the roof of a multistory building, it is necessary to consider several factors such as the weight of the roof, wind loads, and earthquake forces. It is also important to ensure that the beams are strong enough to handle the tension and compression forces they will undergo during their lifetime.",length
2779,length,noun,la longueur ,How Oscillators Work,reading,LANGL1171A,B2,Civil Engineering,"To determine the stability of the bridge, engineers consider several factors including the length of the supports and the stress on the materials used.",length
2779,length,noun,la longueur ,How Oscillators Work,reading,LANGL1171A,B2,Civil Engineering,The length of the bridge's span was calculated to withstand the wind loads and earthquakes without collapsing.,length
2779,length,noun,la longueur ,How Oscillators Work,reading,LANGL1171A,B2,Civil Engineering,The length and height of the bridge have been calculated to ensure that it can withstand the maximum load without collapsing or breaking.,length
2779,length,noun,la longueur ,How Oscillators Work,reading,LANGL1171A,B2,Civil Engineering,"The structural analysis of a bridge involves calculating the stress and strain on its various components, ensuring that they can withstand the loads placed upon them, as well as considering factors such as the length of the bridge and the materials used.",length
2779,length,noun,la longueur ,How Oscillators Work,reading,LANGL1171A,B2,Civil Engineering,The length of the bridge is an important factor to consider when calculating its maximum load capacity.,length
2779,length,noun,la longueur ,How Oscillators Work,reading,LANGL1171A,B2,Civil Engineering,"In civil engineering, the length of a structure can be calculated using various methods such as linear algebra or finite element analysis. This information is critical for determining the stability and durability of the construction.",length
2845,reach,verb,atteindre,How Capacitors Work,reading,LANGL1171A,B2,Civil Engineering,The contractor successfully reached the target of constructing the bridge on time despite encountering unforeseen geological challenges.,reached
2845,reach,verb,atteindre,How Capacitors Work,reading,LANGL1171A,B2,Civil Engineering,"As the construction crew reached the maximum permissible stress level on the steel beams, they reinforced the structure with additional supports to prevent catastrophic failure.",reached
2845,reach,verb,atteindre,How Capacitors Work,reading,LANGL1171A,B2,Civil Engineering,"The bridge's cables were meticulously designed to reach their optimal tension, ensuring the structural integrity of the span under varying loads and environmental conditions.",reach
2845,reach,verb,atteindre,How Capacitors Work,reading,LANGL1171A,B2,Civil Engineering,"The construction team painstakingly reached the final milestone of the project, having overcome numerous obstacles in their quest to complete the towering skyscraper, a testament to their unwavering determination and exceptional engineering prowess.",reached
2845,reach,verb,atteindre,How Capacitors Work,reading,LANGL1171A,B2,Civil Engineering,"During the excavation, the construction team encountered a layer of solid rock that required the use of specialized equipment to reach the desired depth.",reach
2845,reach,verb,atteindre,How Capacitors Work,reading,LANGL1171A,B2,Civil Engineering,A bridge reaches a span of 30 meters long and has a weight of only 5 tons.,reaches
2845,reach,verb,atteindre,How Capacitors Work,reading,LANGL1171A,B2,Civil Engineering,"In order to reach the design load, the structure needs to be designed to withstand the forces caused by the weight and stress.",reach
2845,reach,verb,atteindre,How Capacitors Work,reading,LANGL1171A,B2,Civil Engineering,"As part of the design process for this bridge, we need to ensure that it can reach the required loads without exceeding its safe limits.",reach
2845,reach,verb,atteindre,How Capacitors Work,reading,LANGL1171A,B2,Civil Engineering,"As a civil engineer, my main responsibility is to ensure that all structures and buildings I design can reach their maximum capacity without collapsing. This requires careful analysis of materials and construction methods, as well as knowledge of building codes and standards.",reach
2845,reach,verb,atteindre,How Capacitors Work,reading,LANGL1171A,B2,Civil Engineering,"To reach a safe design life of a bridge, engineers need to consider various factors such as the type of materials used, the loads it will face during its lifetime and the potential for corrosion.",reach
2845,reach,verb,atteindre,How Capacitors Work,reading,LANGL1171A,B2,Civil Engineering,"Civil engineers are responsible for designing and ensuring that buildings, roads, bridges, and other structures can reach their intended purpose by taking into account various factors such as safety, cost-effectiveness, durability, and aesthetics.",reach
2845,reach,verb,atteindre,How Capacitors Work,reading,LANGL1171A,B2,Civil Engineering,"The construction process for high-rise buildings often requires materials to be transported over great distances, and it can be challenging to reach these locations due to the limited accessibility of some areas.",reach
2845,reach,verb,atteindre,How Capacitors Work,reading,LANGL1171A,B2,Civil Engineering,"The construction of this bridge will reach a maximum height of 300 meters, which requires the use of complex engineering techniques and materials.",reach
2845,reach,verb,atteindre,How Capacitors Work,reading,LANGL1171A,B2,Civil Engineering,"Civil engineers are responsible for designing, planning, and coordinating construction projects that reach a wide range of objectives such as transportation infrastructure, water treatment systems, sewage processing, land reclamation, and more.",reach
2845,reach,verb,atteindre,How Capacitors Work,reading,LANGL1171A,B2,Civil Engineering,The construction team had to reach out to suppliers and contractors within a specific radius to obtain the necessary materials for the bridge construction project.,reach
2845,reach,verb,atteindre,How Capacitors Work,reading,LANGL1171A,B2,Civil Engineering,I always reach out to my colleagues and superiors when I am uncertain about a particular design issue.,reach
2845,reach,verb,atteindre,How Capacitors Work,reading,LANGL1171A,B2,Civil Engineering,The bridge will reach its maximum load capacity when the wind speed exceeds 50 km/h.,reach
2845,reach,verb,atteindre,How Capacitors Work,reading,LANGL1171A,B2,Civil Engineering,She has reached out to several colleagues in her field to gather more information about the new bridge project that she is working on.,reached
2845,reach,verb,atteindre,How Capacitors Work,reading,LANGL1171A,B2,Civil Engineering,The construction team aimed to reach an ideal water pressure level in the new irrigation system by calculating and designing the necessary components.,reach
2845,reach,verb,atteindre,How Capacitors Work,reading,LANGL1171A,B2,Civil Engineering,"The construction company aimed to reach a maximum height of 50 meters in their latest project, utilizing innovative materials and techniques. They were successful in this endeavor, surpassing expectations and achieving an impressive feat of engineering.",reach
2845,reach,verb,atteindre,How Capacitors Work,reading,LANGL1171A,B2,Civil Engineering,"The bridge was designed to reach out over the river, creating a stable connection between its banks.",reach
2845,reach,verb,atteindre,How Capacitors Work,reading,LANGL1171A,B2,Civil Engineering,The bridge will have to be 100 meters long and 30 meters wide in order to reach the opposite bank while maintaining structural integrity.,reach
2845,reach,verb,atteindre,How Capacitors Work,reading,LANGL1171A,B2,Civil Engineering,The construction team needs to carefully plan and design the foundation system of the new bridge so that it can reach its maximum load capacity without exceeding its structural limits.,reach
2845,reach,verb,atteindre,How Capacitors Work,reading,LANGL1171A,B2,Civil Engineering,"To reach a sustainable solution, civil engineers must consider a wide range of factors such as structural stability, cost-effectiveness and environmental impact.",reach
2845,reach,verb,atteindre,How Capacitors Work,reading,LANGL1171A,B2,Civil Engineering,"Reaching consensus on the best solution can be challenging, but by using objective data and clear explanations, engineers can work together to find a balanced approach that meets everyone's needs.",reaching
2845,reach,verb,atteindre,How Capacitors Work,reading,LANGL1171A,B2,Civil Engineering,Civil engineers must ensure that their designs are able to reach structural and safety requirements while maintaining aesthetic appeal and functionality.,reach
2845,reach,verb,atteindre,How Capacitors Work,reading,LANGL1171A,B2,Civil Engineering,"As a civil engineer, I am responsible for ensuring that the bridge we design will be able to reach the maximum load capacity safely.",reach
2845,reach,verb,atteindre,How Capacitors Work,reading,LANGL1171A,B2,Civil Engineering,The final stage of construction involves reaching for the ceiling and installing the roof tiles.,reaching
2845,reach,verb,atteindre,How Capacitors Work,reading,LANGL1171A,B2,Civil Engineering,"Reaching out to the deepest parts of the ground, the construction team used hydraulic drills to excavate the foundation of the new high-rise building. They also had to ensure that the piles they drove into the soil would reach a sufficient depth and width to provide adequate support for the massive structure.",reach
2845,reach,verb,atteindre,How Capacitors Work,reading,LANGL1171A,B2,Civil Engineering,Civil engineers must ensure that their designs reach the intended goal while remaining within budget and time constraints.,reach
2875,current,noun,le courant électrique,How Capacitors Work,reading,LANGL1171A,B2,Civil Engineering,"Currently, the water flow rate in the river channel exceeds its design capacity, which has led to significant erosion and flooding along the banks. This issue can be addressed through the installation of floodplains or modifying the existing structures to increase their discharge capacity.",currently
2875,current,noun,le courant électrique,How Capacitors Work,reading,LANGL1171A,B2,Civil Engineering,"The bridge's weight is distributed along the arch's curved surface, inducing bending actions that cause normal stresses. Current design standards specify minimum reinforcement ratios to ensure adequate capacity to resist these stresses, preventing cracking or yielding of the concrete.",current
2875,current,noun,le courant électrique,How Capacitors Work,reading,LANGL1171A,B2,Civil Engineering,"In the field of civil engineering, understanding the principles of fluid mechanics is crucial when designing structures such as bridges or tunnels that will withstand high currents during floods.",currents
2875,current,noun,le courant électrique,How Capacitors Work,reading,LANGL1171A,B2,Civil Engineering,"Currently, the flow of water in the river must be maintained within the specified range of 0.5 to 2 meters per second, according to the design of the water intake structures.",currently
2875,current,noun,le courant électrique,How Capacitors Work,reading,LANGL1171A,B2,Civil Engineering,"The water currents in rivers and oceans can be used to generate renewable energy through the installation of hydroelectric power plants. This process involves the harnessing of the kinetic energy of moving water to turn turbines that drive generators, thereby providing a clean source of electricity to urban areas.",currents
2875,current,noun,le courant électrique,How Capacitors Work,reading,LANGL1171A,B2,Civil Engineering,"The current of a river is an important factor to consider when designing bridges and other structures that need to be able to withstand its flow. Engineers must take into account the speed, depth, and direction of the water when calculating the necessary forces and loads required to maintain stability and safety.",current
2875,current,noun,le courant électrique,How Capacitors Work,reading,LANGL1171A,B2,Civil Engineering,"Current refers to the continuous flow of water or air that exists at present. In civil engineering, it can be used to describe the movement of rivers, streams and other bodies of water, as well as the direction of wind flow, temperature changes or electromagnetic activity in electronics circuits.",current
2875,current,noun,le courant électrique,How Capacitors Work,reading,LANGL1171A,B2,Civil Engineering,I am working on the design and analysis of a new bridge that will be able to withstand high currents without collapsing.,currents
2875,current,noun,le courant électrique,How Capacitors Work,reading,LANGL1171A,B2,Civil Engineering,The current in the river poses a significant challenge for the design of the floodgates.,current
2875,current,noun,le courant électrique,How Capacitors Work,reading,LANGL1171A,B2,Civil Engineering,"Current flow can be calculated using the Moody chart, which takes into account the water temperature and specific gravity. The velocity can then be determined from the Moody chart for each pipe size.",current
2875,current,noun,le courant électrique,How Capacitors Work,reading,LANGL1171A,B2,Civil Engineering,"The current is an essential part of hydraulic design, where it plays a crucial role in ensuring that water flows through channels and turbines with minimal energy losses.",current
2875,current,noun,le courant électrique,How Capacitors Work,reading,LANGL1171A,B2,Civil Engineering,"The current is responsible for the movement of water through rivers and streams. As an engineer, one must consider the it when designing water intake systems or determining optimal flow rates for irrigation purposes.",current
2875,current,noun,le courant électrique,How Capacitors Work,reading,LANGL1171A,B2,Civil Engineering,"In civil engineering, the current refers to the rate at which water flows through a pipe or channel. It is important to determine its value when designing water supply systems as it affects the pressure and volume of water that can be transported.",current
2875,current,noun,le courant électrique,How Capacitors Work,reading,LANGL1171A,B2,Civil Engineering,"The current flow rate of the river can be calculated using the following equation: q = mi, where q is the flow rate of the water, m is its mass flow rate and i is its velocity.",current
2875,current,noun,le courant électrique,How Capacitors Work,reading,LANGL1171A,B2,Civil Engineering,"Understanding the behavior of the current is crucial for designing dams, bridges, weirs, intakes and other hydraulic structures.",current
2875,current,noun,le courant électrique,How Capacitors Work,reading,LANGL1171A,B2,Civil Engineering,"A current is a continuous flow of water, gas or electricity. In civil engineering, it refers to a continuous movement or flow of something, such as water, air or traffic.",current
2875,current,noun,le courant électrique,How Capacitors Work,reading,LANGL1171A,B2,Civil Engineering,The current flow rate and its variation with time are important parameters for designing and analyzing water supply systems.,current
2875,current,noun,le courant électrique,How Capacitors Work,reading,LANGL1171A,B2,Civil Engineering,"Currents refer to the movement or flow of a fluid, such as water, air or gas. In civil engineering, understanding them is important because they can have a significant impact on the design and construction of infrastructure, particularly in the case of rivers, streams, and coastal waters.",currents
2875,current,noun,le courant électrique,How Capacitors Work,reading,LANGL1171A,B2,Civil Engineering,The current flow in rivers and streams is an important consideration for civil engineers when designing flood control systems and water treatment plants.,current
2875,current,noun,le courant électrique,How Capacitors Work,reading,LANGL1171A,B2,Civil Engineering,"In civil engineering, current refers to the flow of water or other fluids through pipes, channels, or rivers.",current
2875,current,noun,le courant électrique,How Capacitors Work,reading,LANGL1171A,B2,Civil Engineering,"The current in a river can be affected by various factors such as rainfall, temperature changes and manmade activities like construction of dams.",current
2875,current,noun,le courant électrique,How Capacitors Work,reading,LANGL1171A,B2,Civil Engineering,"The current represents the rate at which water flows downstream, and it can be measured using various instruments such as flow meters or vortex sheds.",current
2875,current,noun,le courant électrique,How Capacitors Work,reading,LANGL1171A,B2,Civil Engineering,"Current refers to the flow of water or air through a conduit such as a pipe, channel, or stream.",current
2875,current,noun,le courant électrique,How Capacitors Work,reading,LANGL1171A,B2,Civil Engineering,"The current flow rate in a river can be used to predict its water levels, which is a critical factor for civil engineers designing flood control systems.",current
2875,current,noun,le courant électrique,How Capacitors Work,reading,LANGL1171A,B2,Civil Engineering,The current flow rate and its variations are important parameters in the design of water supply systems as well as wastewater treatment plants.,current
2875,current,noun,le courant électrique,How Capacitors Work,reading,LANGL1171A,B2,Civil Engineering,The current flow rate through a pipe is dependent on its diameter and length.,current
2875,current,noun,le courant électrique,How Capacitors Work,reading,LANGL1171A,B2,Civil Engineering,"In civil engineering, currents are an important factor that must be considered when designing structures such as bridges and tunnels to prevent erosion and damage to the structure.",currents
2875,current,noun,le courant électrique,How Capacitors Work,reading,LANGL1171A,B2,Civil Engineering,The current flow of water through the pipe varies depending on the pressure drop across the system and the volume of fluid being transported.,current
2875,current,noun,le courant électrique,How Capacitors Work,reading,LANGL1171A,B2,Civil Engineering,"The current flow through a pipe can be calculated by dividing the pressure drop across the pipe by its resistance. However, as water flows through a pipe, it is common for the pressure to decrease and the velocity to increase, resulting in turbulence. This can cause cavitation and erosion of the pipe material, which may result in leaks or failure of the system.",current
2875,current,noun,le courant électrique,How Capacitors Work,reading,LANGL1171A,B2,Civil Engineering,The design of the bridge must take into consideration the current flow rate and direction to ensure its structural integrity.,current
2875,current,noun,le courant électrique,How Capacitors Work,reading,LANGL1171A,B2,Civil Engineering,The engineer must ensure that the current flow through the transformer is within safe limits to prevent overloading and possible malfunction.,current
2875,current,noun,le courant électrique,How Capacitors Work,reading,LANGL1171A,B2,Civil Engineering,A good understanding of the current flow in rivers and streams is essential for designing efficient and sustainable hydraulic systems.,current
2875,current,noun,le courant électrique,How Capacitors Work,reading,LANGL1171A,B2,Civil Engineering,"The current flow in rivers and streams is a critical factor that civil engineers must consider when designing bridges, culverts, and other structures to minimize erosion and damage caused by floods.",current
2942,steel,noun,acier,Top 10 Modern Engineering Marvels in the World,reading,LANGL1171A,B2,Civil Engineering,"The structural steelwork of the building was designed to withstand high compressive forces, ensuring the stability and integrity of the superstructure throughout its operational life.",steelwork
2942,steel,noun,acier,Top 10 Modern Engineering Marvels in the World,reading,LANGL1171A,B2,Civil Engineering,"An important aspect of civil engineering is ensuring the structural integrity of steel structures, which require regular inspections and maintenance.",steel
2942,steel,noun,acier,Top 10 Modern Engineering Marvels in the World,reading,LANGL1171A,B2,Civil Engineering,The steel beams supporting the structure were subjected to rigorous testing to ensure their strength and durability under extreme loading conditions.,steel
2942,steel,noun,acier,Top 10 Modern Engineering Marvels in the World,reading,LANGL1171A,B2,Civil Engineering,"The steel reinforcement bars were strategically positioned within the concrete structure to enhance its tensile strength and prevent cracking under load, ensuring the bridge's structural integrity and longevity.",steel
2942,steel,noun,acier,Top 10 Modern Engineering Marvels in the World,reading,LANGL1171A,B2,Civil Engineering,"Steel is a widely used material in civil engineering due to its strength, durability and resistance to corrosion. It is commonly utilized in the construction of buildings, bridges, and other structures that require reinforcement to withstand high loads and stresses.",steel
2942,steel,noun,acier,Top 10 Modern Engineering Marvels in the World,reading,LANGL1171A,B2,Civil Engineering,"The steel reinforcement in concrete structures provides strength and durability, which is essential for ensuring structural integrity.",steel
2942,steel,noun,acier,Top 10 Modern Engineering Marvels in the World,reading,LANGL1171A,B2,Civil Engineering,"The Eiffel tower, one of the most famous landmarks in the world, was constructed using steel as its primary building material.",steel
2942,steel,noun,acier,Top 10 Modern Engineering Marvels in the World,reading,LANGL1171A,B2,Civil Engineering,"Steel is widely used as a building material due to its strength, durability and resistance to rust.",steel
2942,steel,noun,acier,Top 10 Modern Engineering Marvels in the World,reading,LANGL1171A,B2,Civil Engineering,"Steel is an essential material used in construction due to its high strength and durability. It is commonly used for reinforcing bars, beams, columns, and girders, as well as in bridges, tunnels, and other large-scale structures.",steel
2942,steel,noun,acier,Top 10 Modern Engineering Marvels in the World,reading,LANGL1171A,B2,Civil Engineering,"Steel frames can support heavy loads without buckling or breaking, making it an ideal material for large structures.",steel
2942,steel,noun,acier,Top 10 Modern Engineering Marvels in the World,reading,LANGL1171A,B2,Civil Engineering,"In many civil engineering projects, steel is used extensively as it possesses a high level of strength and durability.",steel
2942,steel,noun,acier,Top 10 Modern Engineering Marvels in the World,reading,LANGL1171A,B2,Civil Engineering,"Steel is often used for constructing bridges and buildings due to its high strength and durability. It can be easily shaped into various forms, making it ideal for creating intricate designs.",steel
2942,steel,noun,acier,Top 10 Modern Engineering Marvels in the World,reading,LANGL1171A,B2,Civil Engineering,"Steel is widely used in civil engineering as a structural material due to its strength, durability and resistance to corrosion. It is often employed in beams, columns, trusses, and bridges due to its ability to support heavy loads without deforming or failing under stress.",steel
2942,steel,noun,acier,Top 10 Modern Engineering Marvels in the World,reading,LANGL1171A,B2,Civil Engineering,"Steel is a strong and durable material with high tensile strength, making it ideal for load-bearing structures. However, it can be susceptible to corrosion, so protective measures such as galvanization or paint application are necessary to maintain its integrity over time.",steel
2942,steel,noun,acier,Top 10 Modern Engineering Marvels in the World,reading,LANGL1171A,B2,Civil Engineering,"As a civil engineer, one must be familiar with the properties and applications of steel in various construction projects.",steel
