Item ID,Item,POS,Translation,Lesson Title,Reading or Listening,Course Code,CEFR Level,Domain,Context,Target Word
2964,achievement,noun,"exploit, réussite",The story of maths,listening,LANG1861,B1,Science,Scientists around the world have contributed to the impressive achievements in the field of genetic engineering.,achievements
2964,achievement,noun,"exploit, réussite",The story of maths,listening,LANG1861,B1,Science,The young scientist's remarkable achievement was recognized with the prestigious Nobel Prize for pioneering groundbreaking research in quantum physics.,achievement
2964,achievement,noun,"exploit, réussite",The story of maths,listening,LANG1861,B1,Science,The researcher's achievement in developing a new vaccine has made a significant contribution to global health.,achievement
2995,ahead,adverb,avant,Global weirding,listening,LANG1861,B1,Science,The researchers raced ahead to unlock the secrets of the newly discovered gene.,ahead
2995,ahead,adverb,avant,Global weirding,listening,LANG1861,B1,Science,"The research team is ahead of schedule, having already collected and analyzed a significant portion of the data.",ahead
2995,ahead,adverb,avant,Global weirding,listening,LANG1861,B1,Science,Your results show significant progress ahead of the previous year's data.,ahead
2995,ahead,adverb,avant,Global weirding,listening,LANG1861,B1,Science,"As the year progressed, the research was significantly ahead of schedule, allowing for additional experiments to be conducted.",ahead
2995,ahead,adverb,avant,Global weirding,listening,LANG1861,B1,Science,The project's success may be affected by the timely completion of several tasks ahead of schedule.,ahead
2995,ahead,adverb,avant,Global weirding,listening,LANG1861,B1,Science,"The microbe's rate of propagation exceeds that of any other organism, making it well ahead in the race for survival.",ahead
2995,ahead,adverb,avant,Global weirding,listening,LANG1861,B1,Science,"In the field of nanotechnology, researchers are making significant progress ahead in developing materials with enhanced properties.",ahead
2995,ahead,adverb,avant,Global weirding,listening,LANG1861,B1,Science,Scientists use computer simulations to predict the behavior of molecules ahead of time.,ahead
2995,ahead,adverb,avant,Global weirding,listening,LANG1861,B1,Science,"The results of the experiment were promising, with the new treatment group showing significant progress ahead of the control group in terms of recovery time.",ahead
2995,ahead,adverb,avant,Global weirding,listening,LANG1861,B1,Science,"In this study, scientists have found that climate change could have an impact on the development of new medicines ahead of time.",ahead
2995,ahead,adverb,avant,Global weirding,listening,LANG1861,B1,Science,"The researchers were confident that the gene therapy would go ahead, as the trials had shown promising results.",ahead
2995,ahead,adverb,avant,Global weirding,listening,LANG1861,B1,Science,"The research team is ahead of schedule in developing the new drug, thanks to their innovative approach.",ahead
2995,ahead,adverb,avant,Global weirding,listening,LANG1861,B1,Science,The path of a neutron ahead of the target nucleus allows scientists to predict where the reaction will occur.,ahead
2995,ahead,adverb,avant,Global weirding,listening,LANG1861,B1,Science,"The experiment is ahead of schedule, and the results will be available by the end of the week.",ahead
2995,ahead,adverb,avant,Global weirding,listening,LANG1861,B1,Science,I have studied many aspects of physics ahead to solve complex equations that govern different phenomena in nature.,ahead
2995,ahead,adverb,avant,Global weirding,listening,LANG1861,B1,Science,The new discovery in genetics will certainly open up exciting possibilities for treating diseases ahead of time.,ahead
2995,ahead,adverb,avant,Global weirding,listening,LANG1861,B1,Science,"The rocket soared ahead, leaving the Earth's atmosphere behind.",ahead
2995,ahead,adverb,avant,Global weirding,listening,LANG1861,B1,Science,The team is working ahead of schedule and is expected to finish the project prematurely.,ahead
2995,ahead,adverb,avant,Global weirding,listening,LANG1861,B1,Science,Scientists have predicted that global temperatures will continue to rise ahead of their current levels.,ahead
2995,ahead,adverb,avant,Global weirding,listening,LANG1861,B1,Science,"The experiment is running well ahead of schedule, and the results are promising.",ahead
2995,ahead,adverb,avant,Global weirding,listening,LANG1861,B1,Science,"Scientists are ahead of schedule with their research on climate change, with promising results expected within the year.",ahead
2995,ahead,adverb,avant,Global weirding,listening,LANG1861,B1,Science,"Going ahead, we will explore the relationship between the acceleration of a moving object and the force applied to it.",ahead
2995,ahead,adverb,avant,Global weirding,listening,LANG1861,B1,Science,"The development of artificial intelligence is rapidly progressing ahead, with breakthroughs occurring at an unprecedented pace.",ahead
2995,ahead,adverb,avant,Global weirding,listening,LANG1861,B1,Science,Biologists predict that temperature changes will have an effect on gene expression patterns ahead of any observable phenotypic alterations.,ahead
2995,ahead,adverb,avant,Global weirding,listening,LANG1861,B1,Science,"The researcher forged ahead with her investigation, meticulously collecting data to support her hypothesis.",ahead
2995,ahead,adverb,avant,Global weirding,listening,LANG1861,B1,Science,"The team is far ahead in the development of a cure for cancer, having completed phase three clinical trials.",ahead
2995,ahead,adverb,avant,Global weirding,listening,LANG1861,B1,Science,The new research aims to solve serious scientific problems that are facing humanity ahead of time.,ahead
2995,ahead,adverb,avant,Global weirding,listening,LANG1861,B1,Science,"The project is ahead of schedule, and the researchers are optimistic about completing it on time.",ahead
2995,ahead,adverb,avant,Global weirding,listening,LANG1861,B1,Science,"Although the technology developed ahead of schedule, the team still had to overcome some unexpected challenges.",ahead
2995,ahead,adverb,avant,Global weirding,listening,LANG1861,B1,Science,Some researchers are ahead of the curve in their understanding of the new technology.,ahead
3184,allow,verb,"autoriser, permettre",Ecocities,reading,LANG1861,B1,Science,The experiment allowed scientists to determine the effects of different variables on the outcome.,allowed
3184,allow,verb,"autoriser, permettre",Ecocities,reading,LANG1861,B1,Science,"Scientists use the concept of thermodynamics to explain how heat energy can be transferred between two objects, allowing for the conversion of energy into different forms.",allowing
3184,allow,verb,"autoriser, permettre",Ecocities,reading,LANG1861,B1,Science,The experiment allowed scientists to observe the effects of different variables on the growth of bacteria.,allowed
3184,allow,verb,"autoriser, permettre",Ecocities,reading,LANG1861,B1,Science,The experiment allowed us to explore the effects of different environmental factors on plant growth.,allowed
3184,allow,verb,"autoriser, permettre",Ecocities,reading,LANG1861,B1,Science,The chemical equation representing the process of photosynthesis allows carbon dioxide to be converted into oxygen.,allows
3184,allow,verb,"autoriser, permettre",Ecocities,reading,LANG1861,B1,Science,The experiment allows us to test the theory that light travels faster than sound.,allows
3184,allow,verb,"autoriser, permettre",Ecocities,reading,LANG1861,B1,Science,"The researcher did not allow uncontrolled variables to influence the results of the experiment, ensuring the reliability of the data.",allow
3184,allow,verb,"autoriser, permettre",Ecocities,reading,LANG1861,B1,Science,Allowing the reaction to proceed to completion requires the presence of an enzyme that catalyzes the conversion of substrate A into product B.,allowing
3184,allow,verb,"autoriser, permettre",Ecocities,reading,LANG1861,B1,Science,Scientists will allow the production of genetically modified foods only if they pass rigorous safety tests.,allow
3184,allow,verb,"autoriser, permettre",Ecocities,reading,LANG1861,B1,Science,"The experiments were allowed to proceed without any interruptions, as long as they did not exceed the safety limits.",allowed
3184,allow,verb,"autoriser, permettre",Ecocities,reading,LANG1861,B1,Science,The experimental process does not allow for any deviation from the prescribed protocol.,allow
3184,allow,verb,"autoriser, permettre",Ecocities,reading,LANG1861,B1,Science,This experiment allows us to explore the effects of different variables on the rate of a chemical reaction.,allows
3184,allow,verb,"autoriser, permettre",Ecocities,reading,LANG1861,B1,Science,The teacher will allow the class to conduct their own experiment if they follow safety protocols.,allow
3184,allow,verb,"autoriser, permettre",Ecocities,reading,LANG1861,B1,Science,The experiment allowed us to investigate the effects of different concentrations of fertilizer on plant growth.,allowed
3184,allow,verb,"autoriser, permettre",Ecocities,reading,LANG1861,B1,Science,The study showed that exposure to certain chemicals allowed for the development of cancer.,allowed
3184,allow,verb,"autoriser, permettre",Ecocities,reading,LANG1861,B1,Science,The experiment was allowed to run for 24 hours to ensure accurate results.,allowed
3184,allow,verb,"autoriser, permettre",Ecocities,reading,LANG1861,B1,Science,Scientists allow experiments to proceed only if they comply with safety regulations.,allow
3184,allow,verb,"autoriser, permettre",Ecocities,reading,LANG1861,B1,Science,The results allow us to conclude that this new approach to teaching science is effective.,allow
3184,allow,verb,"autoriser, permettre",Ecocities,reading,LANG1861,B1,Science,The teacher allowed students to conduct their experiment and collect data.,allowed
3184,allow,verb,"autoriser, permettre",Ecocities,reading,LANG1861,B1,Science,The experiment allowed us to understand the effects of different temperatures on the rate of a chemical reaction.,allowed
3184,allow,verb,"autoriser, permettre",Ecocities,reading,LANG1861,B1,Science,"The experiment allowed the researchers to study the effects of the new drug on the immune system, providing valuable insights into its potential therapeutic applications.",allowed
3184,allow,verb,"autoriser, permettre",Ecocities,reading,LANG1861,B1,Science,A plant cell has an enzyme called ribonuclease that allows it to degrade RNA molecules.,allows
3184,allow,verb,"autoriser, permettre",Ecocities,reading,LANG1861,B1,Science,"Scientists often allow variables to remain constant, so that they can isolate and investigate specific phenomena.",allow
3184,allow,verb,"autoriser, permettre",Ecocities,reading,LANG1861,B1,Science,The experiment allowed scientists to observe the effects of different variables on the growth of the plant.,allowed
3184,allow,verb,"autoriser, permettre",Ecocities,reading,LANG1861,B1,Science,The researcher allowed the bacteria to grow in a nutrient-rich medium for 24 hours to observe their growth patterns.,allowed
3184,allow,verb,"autoriser, permettre",Ecocities,reading,LANG1861,B1,Science,This experiment allows us to observe the effects of different variables on the growth of bacteria.,allows
3184,allow,verb,"autoriser, permettre",Ecocities,reading,LANG1861,B1,Science,The principle of conservation of mass allows scientists to understand the behavior of matter and energy in various reactions.,allows
3184,allow,verb,"autoriser, permettre",Ecocities,reading,LANG1861,B1,Science,The experiment allowed us to conclude that the new drug is effective in treating the disease.,allowed
3184,allow,verb,"autoriser, permettre",Ecocities,reading,LANG1861,B1,Science,The experiment allows us to observe the effects of varying temperature on the rate of a chemical reaction.,allows
3184,allow,verb,"autoriser, permettre",Ecocities,reading,LANG1861,B1,Science,"In scientific experiments, participants are often allowed to choose the order in which they complete the tasks.",allowed
3322,across,adverb,à travers,The Carbon Cycle,reading,LANG1861,B1,Science,The liquid can be passed across a membrane through a process called osmosis.,across
3322,across,adverb,à travers,The Carbon Cycle,reading,LANG1861,B1,Science,The study of genetics across different species can help us understand the evolution of life.,across
3322,across,adverb,à travers,The Carbon Cycle,reading,LANG1861,B1,Science,"The new bridge will span across the river, connecting the city's two sides.",across
3322,across,adverb,à travers,The Carbon Cycle,reading,LANG1861,B1,Science,"The microscope shows a cross-section across the stem, revealing the arrangement of tissues and cells.",across
3322,across,adverb,à travers,The Carbon Cycle,reading,LANG1861,B1,Science,"When analyzing the properties of materials across different temperature ranges, it was found that their conductivity changed significantly.",across
3322,across,adverb,à travers,The Carbon Cycle,reading,LANG1861,B1,Science,"Across the world, scientists collaborate to study the effects of climate change.",across
3322,across,adverb,à travers,The Carbon Cycle,reading,LANG1861,B1,Science,"I studied geology across Europe, comparing rock formations and analyzing their composition.",across
3322,across,adverb,à travers,The Carbon Cycle,reading,LANG1861,B1,Science,"The sound waves traveled across the room, reaching all corners.",across
3322,across,adverb,à travers,The Carbon Cycle,reading,LANG1861,B1,Science,Scientists analyze data across various experiments to determine the most accurate results.,across
3322,across,adverb,à travers,The Carbon Cycle,reading,LANG1861,B1,Science,"Across the world, physicists are collaborating on experiments to prove the existence of dark matter.",across
3322,across,adverb,à travers,The Carbon Cycle,reading,LANG1861,B1,Science,The genetic material within a certain locus is shuffled across chromosomes by genetic recombination during meiosis.,across
3322,across,adverb,à travers,The Carbon Cycle,reading,LANG1861,B1,Science,I used my microscope to observe bacteria across different types of surfaces.,across
3322,across,adverb,à travers,The Carbon Cycle,reading,LANG1861,B1,Science,The results of the research were disseminated across the entire scientific community.,across
3322,across,adverb,à travers,The Carbon Cycle,reading,LANG1861,B1,Science,"The sound waves traveled across the room and reached our ears, making us jump.",across
3322,across,adverb,à travers,The Carbon Cycle,reading,LANG1861,B1,Science,The heat is successfully transferred across the surface of the container by conduction.,across
3322,across,adverb,à travers,The Carbon Cycle,reading,LANG1861,B1,Science,"Across the fluid, the boat uses its sails to capture the wind's force and move forward.",across
3322,across,adverb,à travers,The Carbon Cycle,reading,LANG1861,B1,Science,"During the experiment, I observed that the reaction occurred across different temperature ranges.",across
3322,across,adverb,à travers,The Carbon Cycle,reading,LANG1861,B1,Science,"Across the periodic table, the electronegativity of elements generally increases.",across
3322,across,adverb,à travers,The Carbon Cycle,reading,LANG1861,B1,Science,"The universe expanded rapidly, with matter and energy spreading across space.",across
3322,across,adverb,à travers,The Carbon Cycle,reading,LANG1861,B1,Science,The diversity of species across different habitats highlights the remarkable adaptability of life on Earth.,across
3322,across,adverb,à travers,The Carbon Cycle,reading,LANG1861,B1,Science,"Across the spectrum of visible light, the shortest wavelengths correspond to violet and the longest to red.",across
3322,across,adverb,à travers,The Carbon Cycle,reading,LANG1861,B1,Science,The photons in this experiment were fired across a detector.,across
3322,across,adverb,à travers,The Carbon Cycle,reading,LANG1861,B1,Science,Electrons can move freely across the entire metal surface.,across
3322,across,adverb,à travers,The Carbon Cycle,reading,LANG1861,B1,Science,"The laser beam cuts cleanly across the metal, leaving a smooth and precise edge.",across
3322,across,adverb,à travers,The Carbon Cycle,reading,LANG1861,B1,Science,"In many parts of the world, global warming is causing changes in precipitation patterns that affect agriculture across vast regions.",across
3322,across,adverb,à travers,The Carbon Cycle,reading,LANG1861,B1,Science,Pollen can be dispersed across long distances by wind or animals.,across
3322,across,adverb,à travers,The Carbon Cycle,reading,LANG1861,B1,Science,"The electron moves across the magnetic field, and its energy level changes.",across
3322,across,adverb,à travers,The Carbon Cycle,reading,LANG1861,B1,Science,The wave of light diffracted across the aperture and created an interference pattern on the other side.,across
3322,across,adverb,à travers,The Carbon Cycle,reading,LANG1861,B1,Science,The microorganism had spread across the entire Petri dish after seven days of cultivation.,across
3322,across,adverb,à travers,The Carbon Cycle,reading,LANG1861,B1,Science,"Across the globe, scientists are working together to develop vaccines for the COVID-19 pandemic.",across
3322,across,adverb,à travers,The Carbon Cycle,reading,LANG1861,B1,Science,"In this simulation, we can see a particle moving across a potential landscape with different energy levels.",across
3322,across,adverb,à travers,The Carbon Cycle,reading,LANG1861,B1,Science,"Across the globe, scientists collaborate on groundbreaking research, sharing knowledge and fostering innovation.",across
3496,actual,adjective,réel (≠ actuel),Can earthquakes be predicted?,reading,LANG1861,B1,Science,The actual temperature recorded for the experiment was significantly lower than the predicted value.,actual
3496,actual,adjective,réel (≠ actuel),Can earthquakes be predicted?,reading,LANG1861,B1,Science,"The actual results of the experiment were significantly different from the predicted ones, which led the researchers to question their hypothesis.",actual
3496,actual,adjective,réel (≠ actuel),Can earthquakes be predicted?,reading,LANG1861,B1,Science,"The actual temperature was much higher than the predicted value, which led to significant experimental errors.",actual
3496,actual,adjective,réel (≠ actuel),Can earthquakes be predicted?,reading,LANG1861,B1,Science,The actual temperature of the planet is higher than expected due to climate change.,actual
3496,actual,adjective,réel (≠ actuel),Can earthquakes be predicted?,reading,LANG1861,B1,Science,"The actual results of the experiment were significantly different from the expected results, indicating that there may be a flaw in the experimental design.",actual
3496,actual,adjective,réel (≠ actuel),Can earthquakes be predicted?,reading,LANG1861,B1,Science,"The actual results of the experiment differed significantly from the predicted values, suggesting the need for further investigation.",actual
3496,actual,adjective,réel (≠ actuel),Can earthquakes be predicted?,reading,LANG1861,B1,Science,The actual temperature of the sample was significantly higher than predicted by the model.,actual
3496,actual,adjective,réel (≠ actuel),Can earthquakes be predicted?,reading,LANG1861,B1,Science,The actual temperature measured by the thermometer was slightly lower than the predicted value.,actual
3496,actual,adjective,réel (≠ actuel),Can earthquakes be predicted?,reading,LANG1861,B1,Science,"In the actual experiment, the hypothesis was disproved due to unexpected results.",actual
3496,actual,adjective,réel (≠ actuel),Can earthquakes be predicted?,reading,LANG1861,B1,Science,The actual temperature of the star is different from its surface temperature.,actual
3496,actual,adjective,réel (≠ actuel),Can earthquakes be predicted?,reading,LANG1861,B1,Science,The actual temperature of the Earth's atmosphere is significantly higher than its average temperature.,actual
3496,actual,adjective,réel (≠ actuel),Can earthquakes be predicted?,reading,LANG1861,B1,Science,The actual temperature on Mars is much lower than the average temperature estimated by NASA.,actual
3496,actual,adjective,réel (≠ actuel),Can earthquakes be predicted?,reading,LANG1861,B1,Science,"The actual results of the experiment differed significantly from the predicted outcomes, prompting a review of the underlying theory.",actual
3496,actual,adjective,réel (≠ actuel),Can earthquakes be predicted?,reading,LANG1861,B1,Science,The actual experiment differs significantly from the one described in the method section of the paper.,actual
3496,actual,adjective,réel (≠ actuel),Can earthquakes be predicted?,reading,LANG1861,B1,Science,"The actual temperature of the solution is 25 degrees Celsius, which is slightly higher than the expected temperature.",actual
3496,actual,adjective,réel (≠ actuel),Can earthquakes be predicted?,reading,LANG1861,B1,Science,The actual weather conditions were far less severe than we had anticipated.,actual
3496,actual,adjective,réel (≠ actuel),Can earthquakes be predicted?,reading,LANG1861,B1,Science,"The actual temperature in Antarctica can vary widely, even on the same day.",actual
3496,actual,adjective,réel (≠ actuel),Can earthquakes be predicted?,reading,LANG1861,B1,Science,"The actual temperature of the water is 25 degrees Celsius, which is significantly lower than the expected temperature of 30 degrees Celsius.",actual
3496,actual,adjective,réel (≠ actuel),Can earthquakes be predicted?,reading,LANG1861,B1,Science,"The actual temperature of the water is 30 degrees Celsius, which is significantly higher than the expected temperature of 25 degrees Celsius.",actual
3496,actual,adjective,réel (≠ actuel),Can earthquakes be predicted?,reading,LANG1861,B1,Science,The actual temperature was recorded using a thermometer.,actual
3496,actual,adjective,réel (≠ actuel),Can earthquakes be predicted?,reading,LANG1861,B1,Science,The actual temperature of the Earth's atmosphere varies depending on altitude.,actual
3496,actual,adjective,réel (≠ actuel),Can earthquakes be predicted?,reading,LANG1861,B1,Science,The actual temperature of the sun varies slightly throughout the year due to the elliptical shape of its orbit around the Earth.,actual
3496,actual,adjective,réel (≠ actuel),Can earthquakes be predicted?,reading,LANG1861,B1,Science,"The actual results of the experiment diverged substantially from the predicted values, leading to a reassessment of the hypothesis.",actual
3496,actual,adjective,réel (≠ actuel),Can earthquakes be predicted?,reading,LANG1861,B1,Science,The study's actual results were much different from the initial hypothesis.,actual
3496,actual,adjective,réel (≠ actuel),Can earthquakes be predicted?,reading,LANG1861,B1,Science,The actual temperature on Mars during the Viking mission was much hotter than predicted.,actual
3496,actual,adjective,réel (≠ actuel),Can earthquakes be predicted?,reading,LANG1861,B1,Science,"In order to enhance the actual size and brightness of an image, a microscope uses lenses to magnify a specimen.",actual
3496,actual,adjective,réel (≠ actuel),Can earthquakes be predicted?,reading,LANG1861,B1,Science,The actual temperature of the room was 25 degrees Celsius.,actual
3496,actual,adjective,réel (≠ actuel),Can earthquakes be predicted?,reading,LANG1861,B1,Science,The actual temperature of the Earth's atmosphere is much warmer than the average temperature.,actual
3496,actual,adjective,réel (≠ actuel),Can earthquakes be predicted?,reading,LANG1861,B1,Science,The actual temperature of the sun is millions of degrees Celsius higher than its surface temperature.,actual
3496,actual,adjective,réel (≠ actuel),Can earthquakes be predicted?,reading,LANG1861,B1,Science,"The actual temperature of the solution was slightly higher than the expected temperature, which could have affected the reaction rate.",actual
3575,actually,adverb,"en fait, vraiment",Hunting the edge of space,listening,LANG1861,B1,Science,"Actually, this new scientific discovery is a major breakthrough that has the potential to revolutionize the field of medicine.",actually
3575,actually,adverb,"en fait, vraiment",Hunting the edge of space,listening,LANG1861,B1,Science,"Actually, the magnifying glass can display the image of an object upside down.",actually
3575,actually,adverb,"en fait, vraiment",Hunting the edge of space,listening,LANG1861,B1,Science,Scientists have discovered that water molecules can actually change form when exposed to extreme temperatures and pressures.,actually
3575,actually,adverb,"en fait, vraiment",Hunting the edge of space,listening,LANG1861,B1,Science,"Actually, the density of water is not constant but changes with temperature.",actually
3575,actually,adverb,"en fait, vraiment",Hunting the edge of space,listening,LANG1861,B1,Science,"Scientists have discovered that water actually boils at 100 degrees Celsius, not 100 degrees Fahrenheit as previously believed.",actually
3575,actually,adverb,"en fait, vraiment",Hunting the edge of space,listening,LANG1861,B1,Science,"Actually, the results of the experiment were inconclusive, so we need to repeat it with a larger sample size.",actually
3575,actually,adverb,"en fait, vraiment",Hunting the edge of space,listening,LANG1861,B1,Science,"Actually, the boiling point of water decreases with increasing altitude.",actually
3575,actually,adverb,"en fait, vraiment",Hunting the edge of space,listening,LANG1861,B1,Science,The temperature increase was actually quite minimal despite the intense sunshine.,actually
