Item ID,Item,POS,Translation,Lesson Title,Reading or Listening,Course Code,CEFR Level,Domain,Context,Target Word
1494,loop,noun,une boucle,How Semiconductors Work,reading,LANGL1171A,B2,Civil Engineering,"In civil engineering, one common type of loop used to transport water is referred to as a gravity siphon. This design requires two pipes connected by a vertical tube known as a ""siphon tube.""",loop
1494,loop,noun,une boucle,How Semiconductors Work,reading,LANGL1171A,B2,Civil Engineering,A loop is a closed circuit in which a fluid flows continuously.,loop
1494,loop,noun,une boucle,How Semiconductors Work,reading,LANGL1171A,B2,Civil Engineering,A loop refers to a closed circuit that allows water or other fluids to circulate continuously.,loop
1494,loop,noun,une boucle,How Semiconductors Work,reading,LANGL1171A,B2,Civil Engineering,"The construction of a bridge or an overpass often includes reinforcing loops, which are continuous steel bands that improve the structural integrity and durability of the structure.",loops
1494,loop,noun,une boucle,How Semiconductors Work,reading,LANGL1171A,B2,Civil Engineering,"A loop is a structure used to control traffic flow on highways and roads, especially during rush hour. It involves a series of ramps that direct vehicles onto and off the highway in both directions, creating a continuous cycle.",loop
1494,loop,noun,une boucle,How Semiconductors Work,reading,LANGL1171A,B2,Civil Engineering,"The design of any bridge, tunnel or other transportation infrastructure should take into consideration the various parameters affecting its performance over time. One such parameter is the need for regular maintenance and repairs. In civil engineering, these tasks are often performed by teams working within a 'loop' or cycle of planning, construction, inspection, and repair.",loop
1494,loop,noun,une boucle,How Semiconductors Work,reading,LANGL1171A,B2,Civil Engineering,"A traffic loop, also called roundabout, is a circular road design that allows vehicles to travel continuously without changing directions.",loop
1494,loop,noun,une boucle,How Semiconductors Work,reading,LANGL1171A,B2,Civil Engineering,A loop in a highway system is used to reduce congestion in high traffic areas by allowing traffic to move around in a closed circuit.,loop
1494,loop,noun,une boucle,How Semiconductors Work,reading,LANGL1171A,B2,Civil Engineering,"The shape of a loop can vary depending on the specific application, but it typically consists of a continuous curve or series of curves.",loop
1494,loop,noun,une boucle,How Semiconductors Work,reading,LANGL1171A,B2,Civil Engineering,"In structural analysis, loops are used to model closed systems where forces are constantly changing.",loops
1494,loop,noun,une boucle,How Semiconductors Work,reading,LANGL1171A,B2,Civil Engineering,"In order to maintain the structural integrity of a suspension bridge, engineers often employ a technique known as 'loop reinforcement,' which involves adding extra steel bars in key areas to provide additional support.",loop
1494,loop,noun,une boucle,How Semiconductors Work,reading,LANGL1171A,B2,Civil Engineering,"In civil engineering, loops are used to create closed systems for the distribution of fluids such as water or air. These can be designed using various materials such as steel, plastic, or even rubber.",loops
1494,loop,noun,une boucle,How Semiconductors Work,reading,LANGL1171A,B2,Civil Engineering,"A loop is a fundamental structural element used in civil engineering to transfer loads from one structure to another or to distribute forces evenly. It can be formed by bending a beam, channel or pipe and is often used in bridges, buildings, and other types of structures where load distribution is critical.",loop
1494,loop,noun,une boucle,How Semiconductors Work,reading,LANGL1171A,B2,Civil Engineering,"In the design of bridges and tunnels, engineers often incorporate a loop into the structure to reduce stresses on materials and provide greater stability.",loop
1494,loop,noun,une boucle,How Semiconductors Work,reading,LANGL1171A,B2,Civil Engineering,The concept of a closed loop system in wastewater treatment is vital for maintaining water quality standards. This process involves the continuous circulation of water through a series of treatment chambers to remove impurities before it is discharged back into the environment.,loop
1494,loop,noun,une boucle,How Semiconductors Work,reading,LANGL1171A,B2,Civil Engineering,"The shape of the loop allows for efficient and effective circulation of fluids without any dead spaces or pockets. This design strategy is particularly useful in industries such as oil and gas production, water treatment, and chemical processing.",loop
1511,bend,verb,plier,Stephen Hawking - Master of the Universe,listening,LANGL1171A,B2,Civil Engineering,"The architectural design of the building needs to be flexible enough to adapt to changing construction methods, and this often requires the use of prefabricated materials. One way to achieve this is through the use of a modular system where individual components are manufactured off-site and then assembled on location. This approach can save time and money, as well as reduce waste and errors associated with traditional construction techniques.  In this context 'bend' could refer to the process of manufacturing or shaping materials to fit a particular design, or to adjusting plans or methods in response to changes in circumstances.",bend
1511,bend,verb,plier,Stephen Hawking - Master of the Universe,listening,LANGL1171A,B2,Civil Engineering,"As a civil engineer, it is my responsibility to ensure that buildings and structures are designed with the correct materials and construction techniques. This includes taking into account various factors such as wind resistance, earthquake resilience, and fire safety regulations. One critical aspect of designing safe and sturdy structures is bending materials to their maximum potential without compromising structural integrity. By using advanced engineering principles, we can create structures that not only meet safety standards but also add aesthetic appeal to the final product.",bending
1511,bend,verb,plier,Stephen Hawking - Master of the Universe,listening,LANGL1171A,B2,Civil Engineering,"I would like to mention that the construction of bridges is an interesting field of civil engineering. When designing a bridge, engineers must take into account various factors such as the load it will bear, the materials used, and the forces acting on it. In many cases, engineers use computer simulations to test their designs before constructing them in real life. Once a design has been approved, engineers will bend and shape the steel beams and other materials to fit together perfectly. The final product is a sturdy bridge that can withstand heavy traffic for years to come.",bend
1511,bend,verb,plier,Stephen Hawking - Master of the Universe,listening,LANGL1171A,B2,Civil Engineering,"During the construction of the bridge, the engineers faced a significant challenge when one of the steel beams refused to bend as per the design specifications. Despite repeated attempts, the beam stubbornly resisted the force applied by the hydraulic press, leading to a temporary halt in the project schedule while the engineers explored alternative solutions.",bend
1511,bend,verb,plier,Stephen Hawking - Master of the Universe,listening,LANGL1171A,B2,Civil Engineering,"During the construction of the suspension bridge, steel cables were bent carefully around the towers to create a suspension system that could withstand the weight of the deck and traffic.",bent
1511,bend,verb,plier,Stephen Hawking - Master of the Universe,listening,LANGL1171A,B2,Civil Engineering,The architects had to bend the rules in order to achieve the desired aesthetics for the new building.,bend
1511,bend,verb,plier,Stephen Hawking - Master of the Universe,listening,LANGL1171A,B2,Civil Engineering,The bridge must be designed to bend so that it can withstand high wind loads and earthquakes.,bend
1511,bend,verb,plier,Stephen Hawking - Master of the Universe,listening,LANGL1171A,B2,Civil Engineering,The design of bridges and other structures must take into account the potential for wind and earthquakes to cause them to bend out of shape.,bend
1511,bend,verb,plier,Stephen Hawking - Master of the Universe,listening,LANGL1171A,B2,Civil Engineering,The design of the bridge needs to take into account the bending stress that occurs under different loading conditions.,bending
1511,bend,verb,plier,Stephen Hawking - Master of the Universe,listening,LANGL1171A,B2,Civil Engineering,The bending of steel beams under load depends on their cross-sectional area and length.,bending
1511,bend,verb,plier,Stephen Hawking - Master of the Universe,listening,LANGL1171A,B2,Civil Engineering,Can you explain why it is important to bend concrete pipes when designing sewer systems?,bend
1511,bend,verb,plier,Stephen Hawking - Master of the Universe,listening,LANGL1171A,B2,Civil Engineering,The structural integrity of a bridge is ensured by incorporating materials that can withstand the constant bending and twisting forces to which bridges are exposed.,bending
1511,bend,verb,plier,Stephen Hawking - Master of the Universe,listening,LANGL1171A,B2,Civil Engineering,"When designing bridges or beams, civil engineers must take into account the stresses and strains that will cause them to bend. This can be achieved through the use of calculations involving factors such as load, material properties, and structural analysis techniques.",bend
1511,bend,verb,plier,Stephen Hawking - Master of the Universe,listening,LANGL1171A,B2,Civil Engineering,"The bridge has to bend around a curve on its path, as a result of the landscape.",bend
1511,bend,verb,plier,Stephen Hawking - Master of the Universe,listening,LANGL1171A,B2,Civil Engineering,Carefully constructed bridges can bend without breaking under stress due to factors such as the use of materials with sufficient tensile strength and proper design techniques.,bend
1511,bend,verb,plier,Stephen Hawking - Master of the Universe,listening,LANGL1171A,B2,Civil Engineering,"Due to the high wind loads, the designer had to bend the bridge columns to ensure their structural integrity.",bend
1511,bend,verb,plier,Stephen Hawking - Master of the Universe,listening,LANGL1171A,B2,Civil Engineering,"As part of my degree in Civil Engineering, I studied the principles of bridge design, including how to bend steel beams effectively to distribute loads and ensure structural integrity.",bend
1511,bend,verb,plier,Stephen Hawking - Master of the Universe,listening,LANGL1171A,B2,Civil Engineering,"In this project, we need to analyze the impact of water on the integrity of concrete structures. When designing bridges and other civil engineering projects, engineers must consider the flexibility of materials to ensure that they do not bend or break under excessive loads.",bend
1511,bend,verb,plier,Stephen Hawking - Master of the Universe,listening,LANGL1171A,B2,Civil Engineering,The civil engineer must consider the bending stresses on the structure to ensure its stability and durability. They should use the appropriate materials and design principles to mitigate the risks associated with deformation under load.,bending
1511,bend,verb,plier,Stephen Hawking - Master of the Universe,listening,LANGL1171A,B2,Civil Engineering,"As a civil engineer, I must understand how to bend materials such as steel or aluminum according to specific engineering standards to create durable and safe structures.",bend
1511,bend,verb,plier,Stephen Hawking - Master of the Universe,listening,LANGL1171A,B2,Civil Engineering,"During the construction process of a suspension bridge, the cable must be able to bend and absorb tension as it supports the weight of the structure.",bend
1511,bend,verb,plier,Stephen Hawking - Master of the Universe,listening,LANGL1171A,B2,Civil Engineering,The proposed design for the bridge involves bending the steel beams to create an arch shape that distributes the weight and stress evenly across the entire structure.,bending
1511,bend,verb,plier,Stephen Hawking - Master of the Universe,listening,LANGL1171A,B2,Civil Engineering,"As a civil engineer, it is important to understand how to properly bend and shape steel beams for structural stability in buildings. The correct bending techniques should be employed to prevent any potential issues that could arise in the future such as cracks or breakage.",bend
1511,bend,verb,plier,Stephen Hawking - Master of the Universe,listening,LANGL1171A,B2,Civil Engineering,The stress on the beam will be affected by the angle at which it bends.,bends
1511,bend,verb,plier,Stephen Hawking - Master of the Universe,listening,LANGL1171A,B2,Civil Engineering,"As part of the construction process, engineers must ensure that the structural integrity of buildings and bridges is maintained. One common method used to achieve this is by bending steel beams according to specific geometric equations. By doing so, they can create a flexible structure that will better withstand the forces of nature and the loads placed upon it.",bending
1511,bend,verb,plier,Stephen Hawking - Master of the Universe,listening,LANGL1171A,B2,Civil Engineering,"The weight of the load placed upon the bridge causes it to bend slightly, and this bending can be used for structural analysis purposes.",bend
1511,bend,verb,plier,Stephen Hawking - Master of the Universe,listening,LANGL1171A,B2,Civil Engineering,"According to the design, the column will need to bend under the stress of the load. This can be achieved by changing its cross-sectional area or increasing the length of the column while maintaining the same material properties.",bend
1511,bend,verb,plier,Stephen Hawking - Master of the Universe,listening,LANGL1171A,B2,Civil Engineering,Bending steel beams to a specific angle to account for the loads placed on them by the structure.,bending
1511,bend,verb,plier,Stephen Hawking - Master of the Universe,listening,LANGL1171A,B2,Civil Engineering,"According to the design, the bridge must be able to bend under the stress of the load while still maintaining its structural integrity.",bend
1511,bend,verb,plier,Stephen Hawking - Master of the Universe,listening,LANGL1171A,B2,Civil Engineering,"In civil engineering, it is important to know the principles of structural mechanics and how they apply to the design of buildings. For instance, during the construction phase, builders often bend steel beams using heat or hydraulic pressure in order to achieve the desired shape and strength.",bend
1511,bend,verb,plier,Stephen Hawking - Master of the Universe,listening,LANGL1171A,B2,Civil Engineering,"As a civil engineer, I am familiar with how to bend steel pipes using various techniques such as welding and bending machines. This knowledge is essential for designing efficient and cost-effective water supply systems.",bend
1511,bend,verb,plier,Stephen Hawking - Master of the Universe,listening,LANGL1171A,B2,Civil Engineering,The engineer must ensure that the foundation of the building bends slightly to withstand earthquakes.,bends
1511,bend,verb,plier,Stephen Hawking - Master of the Universe,listening,LANGL1171A,B2,Civil Engineering,"As a structural engineer, my job requires me to bend the rules when it comes to designing a bridge or any other major engineering project. It can be challenging to work within the constraints set by government regulations and safety standards while still achieving the desired outcomes for our clients.",bend
1829,core,noun,noyau,8 Scientific Laws and Theories You Really Should Know,reading,LANGL1171A,B2,Civil Engineering,The concrete core of the gravity dam provides stability against overturning by resisting the horizontal water pressure acting on the upstream face.,core
1829,core,noun,noyau,8 Scientific Laws and Theories You Really Should Know,reading,LANGL1171A,B2,Civil Engineering,The core of a building provides structural stability and prevents it from collapsing during earthquakes or other natural disasters.,core
1829,core,noun,noyau,8 Scientific Laws and Theories You Really Should Know,reading,LANGL1171A,B2,Civil Engineering,"The core of the dam is constructed from a composite material of concrete and steel, providing exceptional resistance to water pressure and potential seismic activity.",core
1829,core,noun,noyau,8 Scientific Laws and Theories You Really Should Know,reading,LANGL1171A,B2,Civil Engineering,The core of the skyscraper consists of structural beams and steel columns that provide support to the entire building.,core
1829,core,noun,noyau,8 Scientific Laws and Theories You Really Should Know,reading,LANGL1171A,B2,Civil Engineering,The core of the building must be reinforced with extra steel bars to increase its seismic stability.,core
1829,core,noun,noyau,8 Scientific Laws and Theories You Really Should Know,reading,LANGL1171A,B2,Civil Engineering,"The structural core is a critical component of a skyscraper, and its design should be carefully planned to ensure stability and safety during construction and operation.",core
1829,core,noun,noyau,8 Scientific Laws and Theories You Really Should Know,reading,LANGL1171A,B2,Civil Engineering,A well-designed core not only protects the building's structural integrity but also contributes to its aesthetic appeal.,core
1829,core,noun,noyau,8 Scientific Laws and Theories You Really Should Know,reading,LANGL1171A,B2,Civil Engineering,The new bridge core was designed using advanced materials and construction techniques to ensure its structural integrity for decades.,core
1829,core,noun,noyau,8 Scientific Laws and Theories You Really Should Know,reading,LANGL1171A,B2,Civil Engineering,"In civil engineering, the core of a building’s structural system often consists of load-bearing columns and beams that support the weight of the floors above.",core
1829,core,noun,noyau,8 Scientific Laws and Theories You Really Should Know,reading,LANGL1171A,B2,Civil Engineering,"The core of any building or structure must be designed to withstand extreme forces such as earthquakes, hurricanes and other natural disasters.",core
1829,core,noun,noyau,8 Scientific Laws and Theories You Really Should Know,reading,LANGL1171A,B2,Civil Engineering,"The design of a building’s foundation must take into account the core, as it provides structural stability and support for the entire structure.",core
1829,core,noun,noyau,8 Scientific Laws and Theories You Really Should Know,reading,LANGL1171A,B2,Civil Engineering,The core of a skyscraper is responsible for supporting its weight and structural integrity.,core
1829,core,noun,noyau,8 Scientific Laws and Theories You Really Should Know,reading,LANGL1171A,B2,Civil Engineering,The core of the building structure provides structural stability and support for the weight of the floors and roof.,core
1829,core,noun,noyau,8 Scientific Laws and Theories You Really Should Know,reading,LANGL1171A,B2,Civil Engineering,"The core represents an essential element of the structural system in civil engineering, which helps to transmit the applied loads without collapsing under stress. This critical component of any building or structure must be designed and constructed with utmost precision and care to ensure its longevity and safety.",core
1829,core,noun,noyau,8 Scientific Laws and Theories You Really Should Know,reading,LANGL1171A,B2,Civil Engineering,"In civil engineering, the core of a bridge refers to its central part or beam where the weight is distributed evenly. This part must be constructed with high quality materials that can support heavy loads without deforming.",core
1829,core,noun,noyau,8 Scientific Laws and Theories You Really Should Know,reading,LANGL1171A,B2,Civil Engineering,The core of the building has been reinforced with steel bars to ensure structural integrity.,core
1829,core,noun,noyau,8 Scientific Laws and Theories You Really Should Know,reading,LANGL1171A,B2,Civil Engineering,"The core of the building was designed to resist earthquakes by utilizing reinforced concrete and steel columns, which were strategically placed at key points.",core
1829,core,noun,noyau,8 Scientific Laws and Theories You Really Should Know,reading,LANGL1171A,B2,Civil Engineering,"The core of a building is designed to transfer weight and seismic forces from the structure above, ensuring its stability and longevity.",core
1829,core,noun,noyau,8 Scientific Laws and Theories You Really Should Know,reading,LANGL1171A,B2,Civil Engineering,"As a civil engineer, it is my responsibility to ensure that the structural core of a building remains stable and secure for years to come.",core
1829,core,noun,noyau,8 Scientific Laws and Theories You Really Should Know,reading,LANGL1171A,B2,Civil Engineering,The core of a skyscraper typically consists of structural columns and beams that support the weight of the building.,core
1829,core,noun,noyau,8 Scientific Laws and Theories You Really Should Know,reading,LANGL1171A,B2,Civil Engineering,"In civil engineering, the core is an essential part of any building or structure. It refers to the central load-bearing column or wall that supports the weight of the entire structure.",core
1829,core,noun,noyau,8 Scientific Laws and Theories You Really Should Know,reading,LANGL1171A,B2,Civil Engineering,"The core of the building's structural system comprises its foundation and column system, which must be designed to support the weight of the entire structure.",core
1829,core,noun,noyau,8 Scientific Laws and Theories You Really Should Know,reading,LANGL1171A,B2,Civil Engineering,"The core or central part of a building's structure, often made of steel or reinforced concrete, provides support for the floors and roofs above.",core
1829,core,noun,noyau,8 Scientific Laws and Theories You Really Should Know,reading,LANGL1171A,B2,Civil Engineering,"The core of a building refers to its central part, which supports the entire structure and provides stability.",core
1829,core,noun,noyau,8 Scientific Laws and Theories You Really Should Know,reading,LANGL1171A,B2,Civil Engineering,"The core of the building, consisting of reinforced concrete, provides structural support and resists lateral forces.",core
1829,core,noun,noyau,8 Scientific Laws and Theories You Really Should Know,reading,LANGL1171A,B2,Civil Engineering,"In structural engineering, the concept of core refers to the central part or foundation of a building or structure which provides strength and support.",core
1829,core,noun,noyau,8 Scientific Laws and Theories You Really Should Know,reading,LANGL1171A,B2,Civil Engineering,"The core or central part of a building's structure must be designed to withstand significant load and stress. This includes reinforced concrete columns, steel beams, and masonry arches that distribute the weight evenly.",core
1829,core,noun,noyau,8 Scientific Laws and Theories You Really Should Know,reading,LANGL1171A,B2,Civil Engineering,"The core of a building refers to its central structural system, which supports the entire weight of the structure and provides stability.",core
1829,core,noun,noyau,8 Scientific Laws and Theories You Really Should Know,reading,LANGL1171A,B2,Civil Engineering,"The core of any civil engineering project is its foundation, which must be designed to support the weight and stability of the entire structure. This includes considering factors such as soil conditions, wind loads, and earthquake resilience to ensure the safety and longevity of the building or infrastructure.",core
1829,core,noun,noyau,8 Scientific Laws and Theories You Really Should Know,reading,LANGL1171A,B2,Civil Engineering,"The structural core provides stability to high rise buildings and bridges, allowing them to withstand earthquakes and other natural disasters.",core
1992,lack,noun,"pénurie, manque",Can Kinetic Energy Help Power OTG Communities?,reading,LANGL1171A,B2,Civil Engineering,"The lack of skilled labor in the construction industry has hindered the timely completion of infrastructure projects, leading to delays and increased costs. This deficiency in manpower has also contributed to safety concerns, as inexperienced workers may not adhere to proper safety protocols, potentially putting themselves and others at risk.",lack
1992,lack,noun,"pénurie, manque",Can Kinetic Energy Help Power OTG Communities?,reading,LANGL1171A,B2,Civil Engineering,"The bridge was designed to minimize the lack of stability and structural integrity, which allowed it to withstand earthquakes and other natural disasters.",lack
1992,lack,noun,"pénurie, manque",Can Kinetic Energy Help Power OTG Communities?,reading,LANGL1171A,B2,Civil Engineering,"The recently constructed overpass exhibited a noticeable lack of expansion joints, compromising its structural integrity and resilience to thermal stresses.",lack
1992,lack,noun,"pénurie, manque",Can Kinetic Energy Help Power OTG Communities?,reading,LANGL1171A,B2,Civil Engineering,"The structural integrity of a bridge can be compromised by a lack of proper maintenance and repair. Regular inspections, cleaning, and upgrades are crucial in ensuring that the load-bearing capacity remains intact for the expected lifespan of the structure. In some cases, however, unforeseen events such as natural disasters or human error can also lead to structural failure, which may require immediate attention from civil engineers.",lack
1992,lack,noun,"pénurie, manque",Can Kinetic Energy Help Power OTG Communities?,reading,LANGL1171A,B2,Civil Engineering,"The lack of adequate infrastructure, such as transportation networks and energy grids, has been a major obstacle to economic growth in developing countries.",lack
